[
  {
    "hazard_id": "c07_h1",
    "clip_id": "c07",
    "type": "pedestrian_crossing",
    "window_start": 16.2,
    "window_end": 19.0,
    "labellers": {
      "riyu": [
        16.0,
        19.1
      ],
      "fmd": [
        16.4,
        18.9
      ]
    },
    "agreed": true,
    "arbitrated_by": null,
    "auto_window": null,
    "track_id": 4,
    "segment_sources": [
      "s3://TEAM-vss-chunks-segments/segments/EXAMPLE_set03_video_chunk_0014_segment_004_of_006.mp4"
    ],
    "description": "EXAMPLE: pedestrian steps out between parked cars on the right"
  }
]
